{
  "diagnoses" : [ {
    "term_text" : "Bilateral knee pain",
    "omop_domain" : "condition_occurrence",
    "OMOP_ID" : "0"
  }, {
    "term_text" : "Patellofemoral pain syndrome, bilateral",
    "omop_domain" : "condition_occurrence",
    "OMOP_ID" : "0"
  } ],
  "procedures" : [ {
    "term_text" : "Refer to physical therapy",
    "omop_domain" : "procedure_occurrence"
  } ],
  "medications_and_treatments" : [ {
    "term_text" : "over-the-counter NSAIDs",
    "omop_domain" : "drug_exposure",
    "OMOP_ID" : "0"
  } ],
  "tests" : [ {
    "term_text" : "X-ray of the bilateral knees are reviewed",
    "omop_domain" : "observation",
    "OMOP_ID" : "0"
  }, {
    "term_text" : "MRI (previous)",
    "omop_domain" : "observation",
    "OMOP_ID" : "0"
  } ],
  "clinical_narrative" : [ ]
}