{
  "diagnoses" : [ {
    "term_text" : "coronary artery disease",
    "omop_domain" : "condition_occurrence",
    "OMOP_ID" : "0"
  }, {
    "term_text" : "diabetes",
    "omop_domain" : "condition_occurrence",
    "OMOP_ID" : "0"
  } ],
  "procedures" : [ {
    "term_text" : "refer to a urologist",
    "omop_domain" : "procedure_occurrence"
  } ],
  "medications_and_treatments" : [ {
    "term_text" : "Flomax 0.4 mg once at night",
    "omop_domain" : "drug_exposure",
    "OMOP_ID" : "0"
  }, {
    "term_text" : "Lipitor 40 mg a day",
    "omop_domain" : "drug_exposure",
    "OMOP_ID" : "0"
  }, {
    "term_text" : "aspirin",
    "omop_domain" : "drug_exposure",
    "OMOP_ID" : "0"
  }, {
    "term_text" : "metoprolol",
    "omop_domain" : "drug_exposure",
    "OMOP_ID" : "0"
  }, {
    "term_text" : "metformin 1000 mg twice a day",
    "omop_domain" : "drug_exposure",
    "OMOP_ID" : "0"
  } ],
  "tests" : [ {
    "term_text" : "PSA",
    "omop_domain" : "observation",
    "OMOP_ID" : "0"
  }, {
    "term_text" : "urinalysis",
    "omop_domain" : "observation",
    "OMOP_ID" : "0"
  }, {
    "term_text" : "urine culture",
    "omop_domain" : "observation",
    "OMOP_ID" : "0"
  }, {
    "term_text" : "echocardiogram",
    "omop_domain" : "observation",
    "OMOP_ID" : "0"
  }, {
    "term_text" : "lipid panel",
    "omop_domain" : "observation",
    "OMOP_ID" : "0"
  } ],
  "clinical_narrative" : [ ]
}