{
  "diagnoses" : [ {
    "term_text" : "ovarian cancer",
    "omop_domain" : "condition_occurrence",
    "OMOP_ID" : "0"
  }, {
    "term_text" : "abdominal pain",
    "omop_domain" : "condition_occurrence",
    "OMOP_ID" : "0"
  }, {
    "term_text" : "stage IIIA disease",
    "omop_domain" : "condition_occurrence",
    "OMOP_ID" : "0"
  } ],
  "procedures" : [ {
    "term_text" : "surgical intervention",
    "omop_domain" : "procedure_occurrence",
    "OMOP_ID" : "0"
  }, {
    "term_text" : "hysterectomy",
    "omop_domain" : "procedure_occurrence",
    "OMOP_ID" : "0"
  }, {
    "term_text" : "oophorectomy",
    "omop_domain" : "procedure_occurrence",
    "OMOP_ID" : "0"
  }, {
    "term_text" : "lymph node dissection",
    "omop_domain" : "procedure_occurrence",
    "OMOP_ID" : "0"
  }, {
    "term_text" : "genetic counseling and testing",
    "omop_domain" : "procedure_occurrence",
    "OMOP_ID" : "0"
  } ],
  "medications_and_treatments" : [ {
    "term_text" : "cisplatin and Taxol",
    "omop_domain" : "drug_exposure",
    "OMOP_ID" : "0"
  } ],
  "tests" : [ {
    "term_text" : "CT scan of the abdomen",
    "omop_domain" : "observation",
    "OMOP_ID" : "0"
  }, {
    "term_text" : "CA-125",
    "omop_domain" : "measurement",
    "OMOP_ID" : "0"
  }, {
    "term_text" : "hCG",
    "omop_domain" : "observation",
    "OMOP_ID" : "0"
  }, {
    "term_text" : "AFP",
    "omop_domain" : "observation",
    "OMOP_ID" : "0"
  }, {
    "term_text" : "LDH",
    "omop_domain" : "observation",
    "OMOP_ID" : "0"
  } ],
  "clinical_narrative" : [ {
    "term_text" : "unintentional weight loss"
  }, {
    "term_text" : "constipation"
  }, {
    "term_text" : "abnormal vaginal bleeding"
  }, {
    "term_text" : "depression"
  }, {
    "term_text" : "left lower quadrant tenderness to palpation"
  }, {
    "term_text" : "left adnexal mass"
  }, {
    "term_text" : "3 cm left ovarian mass with associated localized lymph node involvement"
  } ]
}