{
  "diagnoses" : [ {
    "term_text" : "PCOS",
    "omop_domain" : "condition_occurrence",
    "OMOP_ID" : "0"
  }, {
    "term_text" : "Cholecystectomy",
    "omop_domain" : "condition_occurrence",
    "OMOP_ID" : "0"
  }, {
    "term_text" : "Right hip degenerative joint disease",
    "omop_domain" : "condition_occurrence",
    "OMOP_ID" : "0"
  } ],
  "procedures" : [ {
    "term_text" : "Cortisone injection into her right hip joint",
    "omop_domain" : "procedure_occurrence"
  } ],
  "medications_and_treatments" : [ {
    "term_text" : "NSAID PRN by mouth",
    "omop_domain" : "drug_exposure",
    "OMOP_ID" : "0"
  } ],
  "tests" : [ {
    "term_text" : "MR arthrogram of the right hip",
    "omop_domain" : "observation",
    "OMOP_ID" : "0"
  } ],
  "clinical_narrative" : [ ]
}