{
  "diagnoses" : [ {
    "term_text" : "Recurrent lung infections",
    "omop_domain" : "condition_occurrence",
    "OMOP_ID" : "0"
  }, {
    "term_text" : "hypersensitivity pneumonitis",
    "omop_domain" : "condition_occurrence",
    "OMOP_ID" : "0"
  } ],
  "procedures" : [ {
    "term_text" : "wear a respirator when working",
    "omop_domain" : "procedure_occurrence"
  } ],
  "medications_and_treatments" : [ {
    "term_text" : "oral steroids",
    "omop_domain" : "drug_exposure",
    "OMOP_ID" : "0"
  } ],
  "tests" : [ {
    "term_text" : "X-ray of the chest shows some round glass opacities",
    "omop_domain" : "observation",
    "OMOP_ID" : "0"
  }, {
    "term_text" : "CT of the lungs will also be ordered today to confirm the diagnosis",
    "omop_domain" : "observation",
    "OMOP_ID" : "0"
  }, {
    "term_text" : "Pulmonary function test was also ordered to assess the severity of his respiratory impairment",
    "omop_domain" : "observation",
    "OMOP_ID" : "0"
  } ],
  "clinical_narrative" : [ ]
}