{
  "diagnoses" : [ {
    "term_text" : "Right index finger hyperextension injury",
    "omop_domain" : "condition_occurrence",
    "OMOP_ID" : "0"
  }, {
    "term_text" : "Stenosing tenosynovitis of right index finger",
    "omop_domain" : "condition_occurrence",
    "OMOP_ID" : "0"
  } ],
  "procedures" : [ {
    "term_text" : "Right index trigger finger cortisone injection",
    "omop_domain" : "procedure_occurrence"
  } ],
  "medications_and_treatments" : [ {
    "term_text" : "Corticosteroid injections",
    "omop_domain" : "drug_exposure",
    "OMOP_ID" : "0"
  }, {
    "term_text" : "Ibuprofen",
    "omop_domain" : "drug_exposure",
    "OMOP_ID" : "0"
  } ],
  "tests" : [ {
    "term_text" : "MRI of the right index finger performed on 04/24/2021",
    "omop_domain" : "measurement",
    "OMOP_ID" : "0"
  } ],
  "clinical_narrative" : [ ]
}