{
  "diagnoses" : [ {
    "term_text" : "diabetes",
    "omop_domain" : "condition_occurrence",
    "OMOP_ID" : "0"
  }, {
    "term_text" : "hypertension",
    "omop_domain" : "condition_occurrence",
    "OMOP_ID" : "320128"
  }, {
    "term_text" : "lower back pain",
    "omop_domain" : "condition_occurrence",
    "OMOP_ID" : "0"
  }, {
    "term_text" : "1+ nonpitting edema of lower extremities",
    "omop_domain" : "condition_occurrence",
    "OMOP_ID" : "0"
  } ],
  "procedures" : [ {
    "term_text" : "physical therapy",
    "omop_domain" : "procedure_occurrence",
    "OMOP_ID" : "0"
  } ],
  "medications_and_treatments" : [ {
    "term_text" : "metformin 500 mg twice daily",
    "omop_domain" : "drug_exposure",
    "OMOP_ID" : "0"
  }, {
    "term_text" : "Norvasc",
    "omop_domain" : "drug_exposure",
    "OMOP_ID" : "0"
  }, {
    "term_text" : "Naprosyn 500 mg twice a day",
    "omop_domain" : "drug_exposure",
    "OMOP_ID" : "0"
  }, {
    "term_text" : "Flexeril 10 mg twice a day",
    "omop_domain" : "drug_exposure",
    "OMOP_ID" : "0"
  } ],
  "tests" : [ {
    "term_text" : "Hemoglobin A1c is 7.1",
    "omop_domain" : "measurement",
    "OMOP_ID" : "0"
  }, {
    "term_text" : "x-ray (not ordered at this stage)",
    "omop_domain" : "observation",
    "OMOP_ID" : "0"
  }, {
    "term_text" : "CBC",
    "omop_domain" : "observation",
    "OMOP_ID" : "0"
  }, {
    "term_text" : "BMP",
    "omop_domain" : "observation",
    "OMOP_ID" : "0"
  }, {
    "term_text" : "repeat EKG",
    "omop_domain" : "observation",
    "OMOP_ID" : "0"
  }, {
    "term_text" : "chest x-ray",
    "omop_domain" : "observation",
    "OMOP_ID" : "0"
  } ],
  "clinical_narrative" : [ {
    "term_text" : "high cholesterol"
  }, {
    "term_text" : "ankle swelling"
  }, {
    "term_text" : "tingling in left leg"
  }, {
    "term_text" : "negative Homan's sign"
  } ]
}