{
  "diagnoses" : [ {
    "term_text" : "Atrial Fibrillation",
    "omop_domain" : "condition_occurrence",
    "OMOP_ID" : "0"
  }, {
    "term_text" : "Right middle finger distal phalanx fracture",
    "omop_domain" : "condition_occurrence",
    "OMOP_ID" : "0"
  } ],
  "procedures" : [ ],
  "medications_and_treatments" : [ {
    "term_text" : "Digoxin",
    "omop_domain" : "drug_exposure",
    "OMOP_ID" : "0"
  }, {
    "term_text" : "Tramadol 50 mg every 6 hours as needed for pain",
    "omop_domain" : "drug_exposure",
    "OMOP_ID" : "0"
  } ],
  "tests" : [ {
    "term_text" : "X-rays of the right middle finger, 3 views obtained on today's visit",
    "omop_domain" : "measurement",
    "OMOP_ID" : "0"
  } ],
  "clinical_narrative" : [ ]
}