{
  "diagnoses" : [ {
    "term_text" : "anemia",
    "omop_domain" : "condition_occurrence",
    "OMOP_ID" : "439777"
  }, {
    "term_text" : "gastritis",
    "omop_domain" : "condition_occurrence",
    "OMOP_ID" : "0"
  } ],
  "procedures" : [ {
    "term_text" : "Endoscopy from the emergency room",
    "omop_domain" : "procedure_occurrence"
  }, {
    "term_text" : "polypectomy",
    "omop_domain" : "procedure_occurrence"
  } ],
  "medications_and_treatments" : [ {
    "term_text" : "Protonix 40 mg once a day",
    "omop_domain" : "drug_exposure",
    "OMOP_ID" : "0"
  } ],
  "tests" : [ {
    "term_text" : "Hemoglobin- 8.2",
    "omop_domain" : "measurement",
    "OMOP_ID" : "0"
  }, {
    "term_text" : "biopsy results are still pending",
    "omop_domain" : "observation",
    "OMOP_ID" : "0"
  }, {
    "term_text" : "Repeat CBC was ordered",
    "omop_domain" : "observation",
    "OMOP_ID" : "0"
  } ],
  "clinical_narrative" : [ ]
}