{
  "diagnoses" : [ {
    "term_text" : "joint pain",
    "omop_domain" : "condition_occurrence",
    "OMOP_ID" : "0"
  }, {
    "term_text" : "arthritis",
    "omop_domain" : "condition_occurrence",
    "OMOP_ID" : "0"
  }, {
    "term_text" : "hypothyroidism",
    "omop_domain" : "condition_occurrence",
    "OMOP_ID" : "0"
  }, {
    "term_text" : "polycystic kidneys",
    "omop_domain" : "condition_occurrence",
    "OMOP_ID" : "0"
  } ],
  "procedures" : [ {
    "term_text" : "kidney transplant",
    "omop_domain" : "procedure_occurrence"
  } ],
  "medications_and_treatments" : [ {
    "term_text" : "Tylenol",
    "omop_domain" : "drug_exposure",
    "OMOP_ID" : "0"
  }, {
    "term_text" : "Synthroid",
    "omop_domain" : "drug_exposure",
    "OMOP_ID" : "0"
  }, {
    "term_text" : "Ultram 50 mg every 6 hours as needed",
    "omop_domain" : "drug_exposure",
    "OMOP_ID" : "0"
  } ],
  "tests" : [ {
    "term_text" : "X-ray of the right knee is unremarkable",
    "omop_domain" : "observation",
    "OMOP_ID" : "0"
  }, {
    "term_text" : "Labs: Within normal limits. White blood cell count is within normal limits. Kidney function is normal",
    "omop_domain" : "observation",
    "OMOP_ID" : "0"
  }, {
    "term_text" : "Autoimmune panel",
    "omop_domain" : "observation",
    "OMOP_ID" : "0"
  }, {
    "term_text" : "Thyroid panel",
    "omop_domain" : "observation",
    "OMOP_ID" : "0"
  } ],
  "clinical_narrative" : [ ]
}